Name,Product Price,Product URL,Rating,No. of Reviews,ASIN,Item Weight,Manufacturer,Model Number,Quantity,Generic Name,Description
F Gear Tycoon 27 Liters Laptop Backpack Sch Bag(Black),"1,149",https://amazon.in/F-Gear-Tycoon-Laptop-Backpack/dp/B071XJ6XV5,4.4 out of 5 stars,239,B071XJ6XV5,790 g,Uber Fashion Merchandise Pvt. Ltd.,Uber01026,1 count,Laptop Backpack,"If you have loads to carry around your search ends here. Here comes a bag which has three huge compartments. Designed keeping in mind the school children with loads of books apart from lunch boxes, water bottles and projects. This bag fits all. A very sturdy and strong bag comes with two bottle pouches and a stationery organizer. Laptop compartment also present. It can also be used as an overnight or a travel backpack for a few days. Comes with the F Gear promise of quality."
Wildcraft Work Packs'18 21 Ltrs Black Laptop Backpack (Streak Plus),"1,549",https://amazon.in/Wildcraft-Packs18-Laptop-Backpack-Streak/dp/B07FC4D9B5,4.4 out of 5 stars,"1,943",B07FC4D9B5,480 g,Wildcraft,STREAK PLUS,N/A,Laptop Backpack,"Fits upto 15 inch. Side mesh pocket for water bottle. Padded back system for carrying comfort. Webbing haul loop. Internal organizer. Material Specifications: 420D Poly Ripstop coated, 210D Nylon Poly Melange, 420D TM Poly Dobby."
"Vivinkaa Sling Bag for Women, Bags for Women, Sling Bag, Purse for Women, Sling Bag for Women Stylish, Sling Bag for Girls, Women Sling Bag, Bag for Girls - Indigo",549,https://amazon.in/Vivinkaa-Womens-Sling-Bag-Blue/dp/B077WSKG53,3.8 out of 5 stars,"1,899",B077WSKG53,280 g,Vivinkaa,part-1,1.00 count,N/A,"Vivinkaa is a young and vivacious brand full of energy and fun that is committed towards offering a wide range of high quality unique products with finest craftsmanship and best price to ensure a awesome buying experience. This bag will catch all the attention and will lead to a perfect finishing touch to your look. This is a very fashionable bag which you can carry with you everyday. It will complement all types of outfit and has ample space to carry all your essentials. Also good for your casual outing and shopping. This bag is a ethnic cotton printed stylish sling bag with pu trims, fringes & tassels."
"Palay Waist Bag For Unisex With Adjustable Strap, Waterproof Fanny Pack Stylish Chest Bag Bum Bag With 4-Zipper Pockets For Travel Party Festival Running Hiking",584,https://amazon.in/PALAY%C2%AE-Shoulder-4-Zipper-Pockets-Adjustable/dp/B08SWGFBNT,4.4 out of 5 stars,308,B08SWGFBNT,139 g,N/A,N/A,1.00 count,N/A,N/A
"Vivinkaa Sling Bag for Women, Bags for Women, Sling Bag, Purse for Women, Sling Bag for Women Stylish, Sling Bag for Girls, Women Sling Bag, Bag for Girls - Indigo",549,https://amazon.in/Vivinkaa-Womens-Sling-Bag-Blue/dp/B077WSKG53,3.8 out of 5 stars,"1,899",B077WSKG53,280 g,Vivinkaa,part-1,1.00 count,N/A,"Vivinkaa is a young and vivacious brand full of energy and fun that is committed towards offering a wide range of high quality unique products with finest craftsmanship and best price to ensure a awesome buying experience. This bag will catch all the attention and will lead to a perfect finishing touch to your look. This is a very fashionable bag which you can carry with you everyday. It will complement all types of outfit and has ample space to carry all your essentials. Also good for your casual outing and shopping. This bag is a ethnic cotton printed stylish sling bag with pu trims, fringes & tassels."
"POLESTAR Noble 32 L Bag for College, School, Office, Casual Multipurpose Backpack with 15.6"" Laptop Compartment, Water Resistant, Unisex Design, Stylish & Durable, 1 Year Warranty",579,https://amazon.in/POLESTAR-Casual-bagpack-School-Backpack/dp/B07PQQ8M7B,3.9 out of 5 stars,"17,556",B07PQQ8M7B,480 g,Scale Polestar Pvt. Ltd.,PS_NOBLE,1.00 count,Casual Laptop Bags,N/A
"TRUE HUMAN® Emperor Anti-Theft backpack with combination lock Laptop bag,office bag for Men and Women | College Bags for Girls & Boys (Zyden)",649,https://amazon.in/TRUE-HUMAN-Anti-Theft-backpack-combination/dp/B09VCHV6T5,3.7 out of 5 stars,"1,128",B09VCHV6T5,700 g,N/A,zyden-1,N/A,N/A,N/A
Gear Vintage2 28L Faux Leather Water Resistant Anti Theft Laptop Bag/Backpack for Men/Women-Navy,970,https://amazon.in/Gear-Vintage2-Leather-Backpack-LBPVG2LTH0501/dp/B07G4HH78P,4.4 out of 5 stars,"3,237",B07G4HH78P,600 g,Gear Merchandise PVT LTD,LBPVG2LTH0501,1 count,Bag,"Gear bags are designed for the quick commute as well for the long journey. these backpacks can be used as laptop bags,adventure bags and so on. Your favorite travel companion, The backpacks come with enough storage space to carry all your requirements."
ADISA 15.6 inch Laptop Backpack Office Bag College Travel Back Pack 32 Ltrs (z-Black),499,https://amazon.in/ADISA-Laptop-Backpack-College-z-Black/dp/B09TPY1G1W,3.9 out of 5 stars,801,B09TPY1G1W,530 g,ADISA,BP041,1.00 count,Laptop backpack,N/A
Impulse rucksack bags 75 litres travel bag for men tourist bag for travel backpack for hiking trekking Bag for men camping thames blue bag with 1 Year Warranty,"1,244",https://amazon.in/Impulse-rucksack-75-backpack-trekking/dp/B09T9XDQ99,4.0 out of 5 stars,364,B09T9XDQ99,900 g,N/A,Banyan 75 Blue,1.00 count,N/A,"Impulse travel bags for men backpack is like Anti-Gravity suspension - feels like you are carrying less weight than is in your mountain bag. These travel backpacks for men have Adjustable harness and Fit-on-the-Fly hipbelt to dial in perfect fit. Impulse traveling bags for men and women comes with Front stretch mesh pocket for quick storage of rain gear or extra layers. trekking bags for men removable floating top lid with dual zippered pockets and web attachment points are extremely useful. Designed keeping in mind the all Customers & Weather conditions, our products are suitable for all age groups. . The backpack's internal mesh pocket compartment is easier to store and combine.One day and multi-day tours with lightweight to normal loads, Comfort and optimal microclimate are decisive factors for the activity. When going outdoors, the most unexpected thing is the weather. Waterproofing is very essential especially when you are going to visit wet places like lakes and areas near water bodies."
DZert Clasy Laptop Bag College Bag for Boys Girls 21 L Nevy Blue,600,https://amazon.in/DZert-Girls-Polyester-White-Backpack/dp/B07H1BPCGQ,3.8 out of 5 stars,"2,401",B07H1BPCGQ,290 g,Rushi Enterprise,CLASY-WHT-BLK-RD,1 Count,School Backpack,N/A
DZert Clasy Laptop Bag College Bag for Boys Girls 21 L Blue White,299,https://amazon.in/DZert-School-Polyester-Backpack-White/dp/B07GXYHFCY,3.8 out of 5 stars,"2,401",B07GXYHFCY,290 g,Rushi Enterprise,CLASY-WHT-BLK-RD,1 Count,School Backpack,N/A
TRUE HUMAN Anti-Theft and USB charging port backpack with security lock Laptop bag|office bag| for men and women (Grey),585,https://amazon.in/TRUE-HUMAN-Anti-Theft-charging-combination/dp/B09H7PK5ML,3.8 out of 5 stars,"1,779",B09H7PK5ML,620 g,1,N/A,N/A,N/A,N/A
"POLESTAR Leader 34 L Bag for College, School, Office, Casual Multipurpose Backpack with 15.6"" Laptop Compartment, Water Resistant, Unisex Design, Stylish & Durable, 1 Year Warranty",599,https://amazon.in/POLESTAR-backpack-Backpack-College-Students/dp/B08X2KRL8B,4.1 out of 5 stars,"3,485",B08X2KRL8B,580 g,POLESTAR,PS_LEADER_NAVYGRY,1.00 count,School Backpack,N/A
"American Tourister Zork Polyester 2 Compartment Laptop Unisex Backpack (Black,Frsz)","3,970",https://amazon.in/American-Tourister-Polyester-Compartment-Backpack/dp/B0BV75WFJP,3.0 out of 5 stars,2,B0BV75WFJP,990 g,American Tourister,AY1*09007,1.00 count,N/A,Zork Polyester 2 Compartment Laptop Unisex Backpack
Okami ZenPack UNO Minimal Laptop Messenger Bag X Briefcase,"1,999",https://amazon.in/Okami-ZenPack-Minimal-Messenger-Briefcase/dp/B0BVZT69JN,4.3 out of 5 stars,18,B0BVZT69JN,1 kg 100 g,Okami Wolf INTL Pvt. Ltd.,N/A,N/A,N/A,N/A
"Gizga Essentials Travel Toiletry Kit Bag for Men & Women, Travel Organizer Case with Handle & Hook, Premium Zipper, Multiple Pockets, Multi-Utility Pouch for Shaving Makeup Cosmetics, Light Grey",413,https://amazon.in/Gizga-Essentials-Organizer-Multi-Utility-Cosmetics/dp/B09WVRKYCJ,4.3 out of 5 stars,117,B09WVRKYCJ,‎194 g,‎Gizga,‎G91,1 count,Travel Toiletry Kit Bag,N/A
TRAWOC 80L Travel Backpack for Outdoor Sport Camp Hiking Trekking Bag Camping Rucksack HK007 (PARENT) 1 Year Warranty,"2,332",https://amazon.in/TRAWOC-Backpack-Trekking-Rucksack-Warranty/dp/B0847PGZZM,4.4 out of 5 stars,"7,201",B0847PGZZM,0.6 g,TRAWOC,HK007,1.00 count,Travel Backpack,"The TRAWOC 80L backpack is perfect for any adventure! This unisex travelling bag is designed for trekking, hiking, and camping, with a premium padded shoulder strap and mesh padding for maximum comfort. The padded back panel ensures breathability during extended wear. This backpack features a premium buckle and YKK zipper for added durability, making it the perfect mountain bag or camping rucksack. The front opening provides easy access to your gear, and the integrated rain cover keeps your belongings dry during inclement weather. This large backpack is suitable for men, women, boys, and girls, and can be used as a biker backpack or riding backpack. It has a Luggage/suitcase-type opening, which makes packing and unpacking a breeze. The back padding ensures that it's comfortable to wear for long periods of time, making it perfect for touring or flight travel. The TRAWOC backpack is perfect for daypack use, with excess storage capacity and weight-bearing capacity too. It's available in a variety of colors and sizes, making it suitable for any adventure or occasion. The 1-year warranty ensures that you'll be able to enjoy your backpack for years to come. Whether you're a tourist, tourister, or outdoor enthusiast, this big bag is perfect for you. It's a must-have for anyone who loves adventure and wants to travel in style and comfort. So, get your TRAWOC backpack today and start your next adventure!"
CAPRIFF 32 L Casual Waterproof Laptop Bag/Backpack for Men Boys & Girls For Office School College Teens & Students with Rain Cover With adjustable Strap With 2 Compartment,499,https://amazon.in/Capriff-Liters-Collage-travell-Backpack/dp/B084T7X2HX,3.8 out of 5 stars,"3,029",B084T7X2HX,420 g,N/A,N/A,N/A,N/A,"Teal in color so that it does not catch dust easily || A SECRET POCKET at bottom || Designed For Comfort- back padded and padded strap for more comfort || made from heavy quality nylon and polyester || best quality zip and chain used || It is fully waterproof to protect your books laptop from rain || best quality material used to design its inside structure || a fully paddded laptop sleeve that fit to all sizes and companies of laptop like HP , Dell , Asus , Lenovo , mi etc"
"SACCI MUCCI Women's Rainbow Sling Bag, Handmade Bags for Females - 100% Vegan Leather and Coated Duck canvas Fabric, Lightweight and Durable",499,https://amazon.in/SACCI-MUCCI-Allamanda-Lightweight-SM1-10_magnolia/dp/B09TDNZ88Z,4.2 out of 5 stars,786,B09TDNZ88Z,250 g,We Make Memories,SM-06,1.00 Bag,N/A,N/A
DZert Clasy Laptop Bag College Bag for Boys Girls 21 L Black,559,https://amazon.in/DZert-Polyester-Black-White-Laptop/dp/B07H193V57,3.8 out of 5 stars,"2,401",B07H193V57,290 g,Rushi Enterprise,CLASY-WHT-BLK-RD,1 Count,School Backpack,N/A
"HARISSONS Bags Vervo 15.6-inch Laptop/Travel/Casual Backpack for Men and Women with Rain Cover (Black, 40 Ltrs) | Quick Access Zippered Pocket, Detailed Organizers & a Detachable Key Chain Holder","2,960",https://amazon.in/Harissons-Vervo-Laptop-Backpack-Built/dp/B07M5P5LW3,4.3 out of 5 stars,"1,976",B07M5P5LW3,1 kg 100 g,Harissons,HB1123BLACK,N/A,N/A,N/A
"COSMUS Madison waterproof Multipurpose Backpack With laptop compartment , 33L","1,420",https://amazon.in/COSMUS-Multipurpose-Backpack-Bag-compartment/dp/B078JVT384,4.2 out of 5 stars,"2,231",B078JVT384,750 g,Cosmus,40051011046,1.00 count,N/A,"Designed to give ultimate comfort, this school bag from Cosmus is a Multipurpose Backpack Bag use it as school bag or regular casual backpack for daily use.  This school bag is designed with copious space and sturdy shoulder straps to help children accommodate all essentials while on the move. Key Features High on quality and durability Attractive design Spacious to accommodate all essentials Two main compartment, two front compartment Two side Mesh pockets Specifications Material PU coated Polyester Fabric. Dimensions: 13 x 18 x 8.5 [inches] (WxHxD); Weight: 755 gms Suggestive Age - 8 Years+"
WILDHORN Laptop Backpack for Men/Women I Waterproof I Travel/Business/College Bookbags Fit 15.6 Inch Laptop,899,https://amazon.in/WILDHORN-Backpack-Compartment-Business-College/dp/B09Q63JWCH,4.0 out of 5 stars,129,B09Q63JWCH,450 g,WildHorn,WHBP-003,1.00 count,Laptop Backpack,N/A
"Safari Seek 32 Ltrs Overnighter Travel Laptop Backpack (Black), Water Resistant Spacious Bag for Travelling and Camping, All-Purpose Bag for Business & Leisure","1,949",https://amazon.in/Safari-Overnighter-Resistant-Travelling-All-Purpose/dp/B097JMR4M6,4.3 out of 5 stars,176,B097JMR4M6,920 g,Safari,SEEK35L21OBBLK,1 Count,BACKPACK,"Seek 32L is a compact offering from Safari's overnighter laptop backpack ranges. Equipped with a unique offering of luggage-like opening (or book opening), this bag is perfect to meet ALL your travel needs - Work or Adventure Leisure! Made out of water-resistant fabric & front panel design, it serves as a highly elegant look. On the inside, cross packing straps are provided to help organise your packing. With a 17"" laptop and a tablet compatibility compartment Seek 32 has a total capacity of 32 liters, provided with compression straps and breathable back mesh that prevents the back of the backpack from overheating. Go ahead and add this friendly Seek overnighter backpack to your travel collection, whether it be for a short business trip or a weekend getaway!"
DZert Kids School Bag Soft Plush Backpacks Cartoon Boys Girls Baby (2-5 Years),425,https://amazon.in/DZert-Fabric-Multicolour-Spiderman-Printed/dp/B07BNS3KNX,3.8 out of 5 stars,"1,446",B07BNS3KNX,300 g,Rushi Enterprise,SF-BAG-P-HATHI-1,1.00 count,Kids Bag,DZert Provide Premium quality bags which are non-toxic and made up of soft velvet because our priority is to provide best and high-quality bags/ backpack to your kids.
"Foldable Travel Duffel Bag,Sport Totes,Shoulder Shopping Bag,Luggage Bag,2 Pack (Pink+Blue)",399,https://amazon.in/Foldable-Travel-Shoulder-Shopping-Luggage/dp/B07VCRL9H3,3.8 out of 5 stars,495,B07VCRL9H3,281 g,DEMON CHEST,N/A,N/A,N/A,♛ 
F Gear Burner Art Lthr Black 22 Ltrs Laptop Backpack (3344),978,https://amazon.in/F-Gear-Burner-Art-Black-Laptop-Backpack/dp/B085QX7J7R,4.2 out of 5 stars,457,B085QX7J7R,740 g,Uber Fashion Merchandise Pvt. Ltd.,3344,1 count,Laptop Backpack,"Sleek and compact design, Spacious and apt capacity, World’s best Japanese brand- YKK Zippers and sliders, Fabric – Premium Art Leather, soft touch, water-resistant, highly resistant to stains and is easy to clean, 2-main zippered compartments, Formal looking official theme, Ergonomic design & comfortable thick padding on the back panel minimizes load stress, Unisex design S-curve backstrap made from high density EPE foam padding (23 density), Premium Business Laptop Backpack, Quilted bottom design to protect your gear. I-pad/ tablet compartment on the front, front pocket for your passport or other small daily accessories, Inside organizer, Inside laptop sleeve suitable for laptop up to 17 inches, Reliable high-density polyester webbing, 2 side stash pocket made from premium, sturdy, anti-tear bottle net fabric, Elastic with long life retention of stretchable ability property, Adjustable straps, Ideal Office/ Business bag, Also suitable for Travel, All the above features make this backpack your most desirable office bag. So, hurry and don’t miss out on this backpack."
COSMUS Vogue Casual Laptop Backpack with USB Charger Port 46cm 26 Litre Maroon College Bag,"1,261",https://amazon.in/Cosmus-Casual-Backpack-Charger-College/dp/B09HX54TGF,4.2 out of 5 stars,"1,390",B09HX54TGF,N/A,N/A,N/A,N/A,N/A,
Wooum Anti Theft Laptop Bag - Backpack For Laptop and Tablet of 15.6 Inch Thick Padded Compartment - Light Weight - Water Resistance – Anti Theft (Black),474,https://amazon.in/Wooum-Anti-Theft-Laptop-Bag/dp/B0BYP7SJ4Q,4.8 out of 5 stars,7,B0BYP7SJ4Q,450 g,Wooum,1873,1.00 count,N/A,N/A
"Arctic Hunter Backpack,Original 41L Expandable Laptop Bag Business Travel Backpack with 17 inch Laptop Pocket 3 in 1 Convertible Laptop Backpack Tech Bag with USB Charging Port Water-resistant Multiple Compartments Large Capacity Bag for Men Women Travel Business College","3,419",https://amazon.in/Adjustable-Backpack-Charging-Resistant-Bussiness/dp/B084NZFNGS,4.5 out of 5 stars,490,B084NZFNGS,N/A,N/A,N/A,N/A,N/A,N/A
Wooum Anti Theft Laptop Bag - Backpack For Laptop and Tablet of 15.6 Inch Thick Padded Compartment - Light Weight - Water Resistance – Anti Theft (Black),474,https://amazon.in/Wooum-Anti-Theft-Laptop-Bag/dp/B0BYP7SJ4Q,4.8 out of 5 stars,7,B0BYP7SJ4Q,450 g,Wooum,1873,1.00 count,N/A,N/A
"Arctic Hunter Backpack,Original 41L Expandable Laptop Bag Business Travel Backpack with 17 inch Laptop Pocket 3 in 1 Convertible Laptop Backpack Tech Bag with USB Charging Port Water-resistant Multiple Compartments Large Capacity Bag for Men Women Travel Business College","3,419",https://amazon.in/Adjustable-Backpack-Charging-Resistant-Bussiness/dp/B084NZFNGS,4.5 out of 5 stars,490,B084NZFNGS,1 kg 360 g,ah arctic hunter,B00227L-Black,N/A,N/A,N/A
"WALKENT Premium 15.6 Inch Large Laptop Bag , Vegan Leather, Waterproof, External USB, Trolley Strap, Cushioned Strap, Scratch Resistant for Men, Women - Ritzy (Large, 28 Ltr, 1 Main Compartment & 7 Pockets)","2,990",https://amazon.in/Ritzy-Waterproof-Hi-Quality-External-Resistant/dp/B09Q172X7J,4.3 out of 5 stars,100,B09Q172X7J,1 kg 30 g,Walkent,Ritzy,1.00 count,Backpack,Introducing the 
"GENIE Miami Casual Backpacks for Women, 14 inch, Stylish and Trendy College backpacks for girls, Water Resistant and Lightweight Mini Bags Latest collection (Rose)",846,https://amazon.in/Genie-Miami-litres-Casual-Backpack/dp/B07SRGQ2R4,4.2 out of 5 stars,"2,126",B07SRGQ2R4,300 g,Safari,MIAMI14CBROS,N/A,Casual Backpack,"Bring your A game with the Genie Miami Midnight backpack. A perfect fusion of prints, structure and design, this backpack is feather light and fully lined for extra strength. It has a spacious compartment with a zipper opening and a side pocket for easy access."
"MOKOBARA The Work Backpack 15.6"" Inch Laptop | Travel Backpack For Men And Women","7,499",https://amazon.in/Mokobara-Backpack-Leather-Resistant-Laptop/dp/B0B7X81X69,4.5 out of 5 stars,51,B0B7X81X69,1 kg 840 g,Designed By Mokobara Lifestyle Private Limited,AllWork,1.00 count,N/A,N/A
"Nishi Medium Kids Backpack Waterproof Backpack, Girls & Women Stylish Trendy College, School & College Bag Black",369,https://amazon.in/Nishi-Backpack-Waterproof-Stylish-College/dp/B0BR9W54MW,3.3 out of 5 stars,24,B0BR9W54MW,399 g,N/A,AE3,N/A,N/A,N/A
"F Gear Blow Laptop Backpack With Rain Cover 32 Liters (Red,Grey) Sch Bag","1,014",https://amazon.in/F-Gear-Blow-Laptop-Backpack-Red/dp/B0749MPCFT,4.4 out of 5 stars,285,B0749MPCFT,890 g,F Gear,Uber01030,1 count,Laptop Backpack,"Well if you are looking for a big bag which is also very Stylish, Durable, Waterproof with a Laptop in built sleeve then your search ends here. Yes you Got it Right!, This F Gear bag has three big compartments to boast of along with a huge horizontal pocket in the front and two bottle holders on both sides of the bag. It has an inbuilt Rain cover neatly tucked away in a concealed pocket along with Reflective Strips and Reflective Printing makes it a natural choice for rainy Season. Support at the base makes it suitable for rough/dirty terrains. Padded Shoulders and Back with Side Compression straps completes the picture. Comes with the F Gear promise for quality."
Gear Classic 20L Faux Leather Water Resistant Anti Theft Laptop Bag/Backpack for Men/Women-Tan,990,https://amazon.in/Classic-Leather-Laptop-Backpack-LBPCLSLTH1901/dp/B07G4CYC74,4.4 out of 5 stars,"2,419",B07G4CYC74,558 g,Gear Merchandise PVT LTD,LBPCLSLTH1901,1 count,Bag,"Gear bags are designed for the quick commute as well for the long journey. these backpacks can be used as laptop bags,adventure bags and so on. Your favorite travel companion, The backpacks come with enough storage space to carry all your requirements."
Gear Moderneco5 21L Water Resistant School Bag/Backpack/College Bag For Men/Women - Navyblue,420,https://amazon.in/Gear-Ltrs-Casual-Backpack-MDBKPECO50504/dp/B0757K36YV,3.9 out of 5 stars,"2,603",B0757K36YV,280 g,Gear Merchandise PVT LTD,MDBKPECO50504,1 count,Bag,"One wide access main compartment, one additional front pocket and one bottle pocket. Easily Adjustable padded shoulder straps with anti-sweat fabric underneath."
"Storite Stylish Multi-Pocket Small Sling Cross Body Travel Messenger One Side Shoulder Bag for Men & Women (Brown, 20.5x9x16.5cm)",798,https://amazon.in/Storite-Leather-Sling-Bag-Brown/dp/B08TR8RMNH,4.0 out of 5 stars,864,B08TR8RMNH,490 g,SaiTech IT Private Limited,PU Leather Mini Sling Bag Brown,1.00 count,N/A,N/A
Gear Bounce 27 Ltrs Water Resistant School Bag/Backpack/College Bag for Men/Women-Grey Orange,634,https://amazon.in/Gear-Bounce-Backpack-Grey-Orange-BKPBOUNCE0604/dp/B097KCLF5F,3.6 out of 5 stars,422,B097KCLF5F,400 g,Gear,BKPBOUNCE0604,N/A,Casual Backpack,"Gear bags are designed for the quick commute as well for the long journey. These backpacks can be used as laptop bags, adventure bags and so on. Your favorite travel companion, the backpacks come with enough storage space to carry all your requirements."
"Safari Seek 32 Ltrs Overnighter Travel Laptop Backpack (Blue), Water Resistant Spacious Bag for Travelling and Camping, All-Purpose Bag for Business & Leisure","1,899",https://amazon.in/Safari-Overnighter-Resistant-Travelling-All-Purpose/dp/B097JM98M1,4.3 out of 5 stars,113,B097JM98M1,920 g,Safari,SEEK35L21OBBLU,1 Count,BACKPACK,"Seek 32L is a compact offering from Safari's overnighter laptop backpack ranges. Equipped with a unique offering of luggage-like opening (or book opening), this bag is perfect to meet ALL your travel needs - Work or Adventure Leisure! Made out of water-resistant fabric & front panel design, it serves as a highly elegant look. On the inside, cross packing straps are provided to help organise your packing. With a 17"" laptop and a tablet compatibility compartment Seek 32 has a total capacity of 32 liters, provided with compression straps and breathable back mesh that prevents the back of the backpack from overheating. Go ahead and add this friendly Seek overnighter backpack to your travel collection, whether it be for a short business trip or a weekend getaway!"
"F Gear Blow Laptop Backpack With Rain Cover 32 Liters (Black,Grey) Sch Bag","1,099",https://amazon.in/F-Gear-Blow-Laptop-Backpack/dp/B078J63VRY,4.3 out of 5 stars,"1,276",B078J63VRY,730 g,Uber Fashion Merchandise Pvt. Ltd.,Uber01030,1 count,Laptop Backpack,"Well if you are looking for a big bag which is also very Stylish, Durable, Waterproof with a Laptop in built sleeve then your search ends here. Yes you Got it Right!, This F Gear bag has three big compartments to boast of along with a huge horizontal pocket in the front and two bottle holders on both sides of the bag. It has an inbuilt Rain cover neatly tucked away in a concealed pocket along with Reflective Strips and Reflective Printing makes it a natural choice for rainy Season. Support at the base makes it suitable for rough/dirty terrains. Padded Shoulders and Back with Side Compression straps completes the picture. Comes with the F Gear promise for quality."
Aristrocrat Unisex Laptop Bag Grey,799,https://amazon.in/Aristocrat-Zeal-Unisex-Grey-Laptop/dp/B0B5YHC1W5,4.4 out of 5 stars,24,B0B5YHC1W5,525 g,"VIP Industries Ltd. DGP House, 5th Floor, 88C Old Prabhadevi Road, Mumbai 400025",BPZEALEGRY,N/A,Laptop Backpacks,"Stylish, Secure feature packed Laptop backpack Spacious Compartment Laptop Compatible Front Quick Access Pocket Power Bank Pocket Padded Grab Handle Shoulder strap re-enforcement"
Half Moon Valex Unisex School Bag/Laptop Backpack/College Bagpack/Office Back Packed | Laptop Bag for Men & Women | School Bags for Boys & Girls with Small Pockets & Laptop Compartment,549,https://amazon.in/Half-Moon-Laptop-Bag-Compartment/dp/B0C1NZLF67,4.6 out of 5 stars,15,B0C1NZLF67,N/A,N/A,N/A,N/A,N/A,N/A
Gear DOUBLE DECKER 31L Water Resistant Laptop Bag/Backpack/Office Bag for Men/Women (Navy-Tan),"2,021",https://amazon.in/Gear-DOUBLE-Resistant-Backpack-Navy-Tan/dp/B0BTJ2T26W,4.0 out of 5 stars,1,B0BTJ2T26W,650 g,Gear Merchandise Pvt Ltd,LBPCBLDKR0519,N/A,"BAGS, BACKPACK,LAPTOP BACKPACK",Each Gear Bag is born in our in-house design & prototyping studio & characterises a recognisable aesthetic & functionality
F Gear Milestone Olive Casual 20 Ltrs Laptop Backpack (3376),"1,071",https://amazon.in/F-Gear-Milestone-Casual-Laptop-Backpack/dp/B08FX1R6WY,4.0 out of 5 stars,745,B08FX1R6WY,870 g,Uber Fashion Merchandise Pvt Ltd,3376,N/A,Laptop Backpack,F Gear Milestone Olive Casual 20 Ltrs Laptop Backpack (3376)
