Name,Product Price,Product URL,Rating,No. of Reviews,ASIN,Item Weight,Manufacturer,Model Number,Quantity,Generic Name,Description
"Artistix Talon Anti Theft Design Laptop Backpack, With USB Charging Port (46 Cm, 25L,Black)",999,https://amazon.in/Artistix-Backpack-Anti-Theft-Charging-Resistance/dp/B082PKX18C,4.3 out of 5 stars,"3,279",B082PKX18C,499 g,"Durant International. Address : GIDC Lodhika, Rajkot-360021, Gujarat. Customer Care : 9809804990",Talon,N/A,N/A,"Business Casual Charging Pack. USB CHARGING, GUARD AGAINST THEFT, WATER REPELLENT FABRIC. For Business travel. Structure: Laptop / Ipad Pocket / Phone / Document / Camera / Zipper Pockets.... Capacity: 15.6 Inches Laptop / I pad / Clothes / water bottle/ Umbrella / Cosmetic. No of Compartment : 1"
"Mi Step Out 12 L Mini Backpack (Small Size, Black, Water Repellant)",398,https://amazon.in/Backpack-Small-Black-Water-Repellant/dp/B088XB5XY8,4.1 out of 5 stars,"8,997",B088XB5XY8,‎200 g,"‎Korrun India Pvt. Ltd, Plot No.25, P2(4&X), 1st Phase, Bidadi Industrial area, Bangalore-562109, Karnataka",‎25740,1 count,Backpack,N/A
AUXTER Faux Leather 23 Cms Duffle Bag(AUX_GB_LE_Black -SE_0521_Black),376,https://amazon.in/AUXTER-BLACKY-Duffel-Emboss-Black/dp/B07F2H25NP,4.3 out of 5 stars,"9,121",B07F2H25NP,300 g,Auxter,AUX_GB_LE_BLACK -SE__0521,N/A,N/A,N/A
F Gear Colorado Grey Orange 39 Ltrs Laptop Backpack (3814),895,https://amazon.in/Gear-Colorado-Orange-Laptop-Backpack/dp/B097K6KD7W,4.3 out of 5 stars,156,B097K6KD7W,630 g,Uber Fashion Merchandise Pvt Ltd,3814,N/A,Laptop Backpack,F Gear presents gigantic laptop backpack blends style and functionality. It comes with substantial capacity to accommodate your laptop and several other essentials with ease. This bag does way more than just look good. It provides extra protection for all your valuable devices. The dimensions of the bag are - 34 x 22 x 52 with a capacity of 39 L. To describe it briefly here are the following points: 1. This backpack is made of polyester fabric and is treated to make it water-resistant. 2. This backpack comes with 2-main zippered compartment with an inside sleeve compatible for laptop. 3. This backpack has a front compartment with an organizer. 4. This backpack comes with one zippered front pocket & one quick access mesh zippered. 5. This backpack is equipped with thick padding with anti-sweat breathable air mesh & adjustable padded shoulder straps for extra comfort. 6. Apart from this it has world’s best Japanese brand YKK zippers and sliders. 7. This backpack has two mesh pockets on both sides. 8. Comes with the F Gear promise of quality and durability.
"Mi Step Out 12 L Mini Backpack (Small Size, Dark Blue, Water Repellant)",398,https://amazon.in/Step-Backpack-Small-Water-Repellant/dp/B088XH1BP7,4.1 out of 5 stars,"8,997",B088XH1BP7,‎200 g,"‎Korrun India Pvt. Ltd, Plot No.25, P2(4&X), 1st Phase, Bidadi Industrial area, Bangalore-562109, Karnataka",‎25741,1 count,Backpack,N/A
Gear Vintage2 Anti Theft Faux Leather 18 cms Tan Laptop Backpack,836,https://amazon.in/Gear-Vintage2-Leather-Backpack-LBPVG2LTH1901/dp/B07G4F3758,4.3 out of 5 stars,"1,555",B07G4F3758,600 g,Gear,LBPVG2LTH1901,1 count,Bag,N/A
"WILDHORN 31L Laptop Backpack for Men/Women I Fits upto 15.6"" Laptop I Waterproof I Travel/Business/College Bookbags",599,https://amazon.in/WILDHORN-Backpack-Compartment-Business-Stitching/dp/B09QL66G55,4.0 out of 5 stars,"1,234",B09QL66G55,640 g,ADL International,BP012,1.00 count,Travel Backpack,N/A
ADISA 32L Large Laptop Backpack Office Bag College Travel Back Pack with rain Cover (Green),599,https://amazon.in/ADISA-Laptop-Backpack-Office-College/dp/B0BPVCBFM7,3.8 out of 5 stars,141,B0BPVCBFM7,650 g,ADISA,BP043,1 Piece,Laptop backpack,N/A
"TRUE HUMAN® Emperor Anti-Theft Pocket backpack With USB charging Port Laptop,office,college,travel bag for men and women(Epower)",649,https://amazon.in/TRUE-Emperor-Anti-Theft-backpack-charging/dp/B0BYB631NR,3.5 out of 5 stars,33,B0BYB631NR,450 g,Rama luxury store,Epower_1,N/A,N/A,N/A
ADISA 32L Large Laptop Backpack Office Bag College Travel Back Pack with rain Cover (Black),599,https://amazon.in/ADISA-Laptop-Backpack-Office-College/dp/B0BPTV3795,3.8 out of 5 stars,141,B0BPTV3795,650 g,ADISA,BP043,1 Piece,Laptop backpack,N/A
"Lunar's 35 L Laptop Office/School/Travel/Business Backpack Water Proof - Fits Up to 15.6 Inch Laptop Notebook, With Raincover, Inside Organiser and 1 Year Warranty (All)",849,https://amazon.in/Lunars-Router-Resistant-Raincover-Organiser/dp/B08YR63B9M,3.8 out of 5 stars,"1,085",B08YR63B9M,550 g,"Akshaya Rubbers, Hebbal Industrial Area, Mysore",Office Laptop Bag with Raincover,1.00 count,N/A,"Lunar's Laptop Travel Bag : A Spacious and durable laptop backpack for travel, casual usage, school / college / office and travel. Size: 19 inch X 13inch X 8.5 inch. Capacity: 35 liters. This travel bagpack is made of high grade water resistant polyester material that gives it strength and durable for long-term use. It carries 12 months warranty for any manufacturing defects. This “MAKE IN INDIA” Product features 2 large zippered compartments, padded laptop sleeve for upto 15.6"" laptops, internal organiser, 2 water bottle /umbrella pockets, padded handle, inbuilt raincover,3D air ventilated back panel for preventing sweat, heavy duty zippers and sliders, and adjustable straps. Ideal bag for boys, girls, men and women"
ADISA Large Laptop Backpack Office Bag College Travel Back Pack with USB (Black),499,https://amazon.in/ADISA-Laptop-Backpack-Office-College/dp/B0BXQZ6Q85,4.0 out of 5 stars,39,B0BXQZ6Q85,650 g,ADISA,BP045,1 Piece,Laptop backpack,"High Quality large and spacious laptop backpack with 1 main laptop compartment and 1 front easy-access pocket. It is ideal for carrying laptop inside with padding for safety and space for laptop accessories like charger, etc. It also has organiser for pens, visiting cards, etc along with space for carrying papers, files, etc. It has provision for holding bottles on one side and has USB charging slot on the other side. It has padded shoulder straps for your comfort."
"Tabelito® Casual Laptop Bag 15.6inch (39.6 cm) , 25 LTR Office College School Bags Business Travel Backpack for Men Women Water Resistant Bags(BLACK)",549,https://amazon.in/Tabelito-Laptop-Backpack-15-6-inch-Repellent/dp/B08Y5S6C2P,4.1 out of 5 stars,"1,733",B08Y5S6C2P,‎449 g,"‎Tabelito Trade India, Tabelito Trade India, Prop No: 5, Ground Floor, Kh No:641, Village Rithala, Land Mark: Near Suzuki service center (Rithala), Contact : +919958166528",‎Laptop backpack,1 Count,Casual Laptop Backpack,"Separate Laptop Compartment: Fits UNDER 15.6 Inch Laptops (Gaming Laptop and Laptop 13 inch to 15.6 inch is recommended to choose )Main Compartment: Thin clothes, headset, books, magazine, camera, CD's, etcFront 2 Compartments: For Phones, pen, keys, wallet, purse, glasses and other small items.Side Pockets: Durable Elasticized Mesh Pockets on both sides, fit water bottle, small compact umbrella and other itemsHandle: Sturdy handle and adjustable shoulder straps"
"AirCase Laptop Bag Backpack Case Pouch for Laptop Backpack for Men & Women,Premium Vegan Leather",918,https://amazon.in/AirCase-C34-Laptop-Backpack-Women/dp/B07QN4KXWG,3.8 out of 5 stars,806,B07QN4KXWG,580 g,AirCase,C34-P,1 Unit,Laptop Backpack,N/A
"Safari Spartan 21 Ltrs Water Resistant Backpack - Teal, S (SPARTAN19CBTEA)",599,https://amazon.in/Safari-Spartan-Water-Resistant-Backpack/dp/B09B277CR5,3.8 out of 5 stars,765,B09B277CR5,350 g,Safari Industries,SPARTAN19CBTEA,N/A,Backpack,N/A
Gear Vintage2 28L Faux Leather Water Resistant Anti Theft Laptop Bag/Backpack for Men/Women-Black,990,https://amazon.in/Gear-Vintage2-Leather-Backpack-LBPVG2LTH0101/dp/B07G44G1DC,4.4 out of 5 stars,"1,770",B07G44G1DC,600 g,Gear Merchandise PVT LTD,LBPVG2LTH0101,1 count,Bag,"Gear bags are designed for the quick commute as well for the long journey. these backpacks can be used as laptop bags,adventure bags and so on. Your favorite travel companion, The backpacks come with enough storage space to carry all your requirements."
Arctic Hunter Backpack Premium Business Backpack for Men Office Travel Laptop Bag with 15.6 Inch Laptop Pocket Water/Scratch-resistant Multiple Pocket Padded College Backpack for Men,"5,699",https://amazon.in/Backpack-Business-Scratch-resistant-Multiple-Comfortable/dp/B0B6FNPN76,4.3 out of 5 stars,98,B0B6FNPN76,N/A,N/A,N/A,N/A,N/A,
Trajectory 15.6 Inch Vegan Leather Messenger Laptop bag for men in Office for all laptop like Apple MacBook with 2 Years Warranty and Spacious Multiple Compartment with Expandable Bottom Used as Shoulder and Handbag for Men,"1,399",https://amazon.in/Trajectory-Elegant-15-6-Laptop-Office/dp/B09RK6NCGC,4.1 out of 5 stars,392,B09RK6NCGC,1 kg 380 g,Trajectory marketing LLP,Trajectory Messenger Bag,1.00 count,Trejectory Laptop Messenger bag,N/A
"Lenovo 15.6"" Casual Backpack B210",749,https://amazon.in/Lenovo-Laptop-Backpack-15-6-Inch-GX40Q17225/dp/B075Y72PHZ,4.2 out of 5 stars,"26,983",B075Y72PHZ,386 g,"Lenovo, Ferns Icon, Level, 2, Outer Ring Rd, Doddanekundi, Mahadevapura, Bengaluru, Karnataka 560157",GX40Q17225,1 U,Backpack,N/A
"Lenovo 15.6"" Professional Backpack, Made in India, Water-resistant,Uncompromised storage, Travel friendly:Fleece-lined PC compartment,Vented,Padded BackPanel & Adjustable shoulder straps,Luggage strap",700,https://amazon.in/Lenovo-Professional-Backpack-Water-resistant-Uncompromised/dp/B08R7S55H4,4.2 out of 5 stars,755,B08R7S55H4,640 g,Lenovo,GX41B33569,N/A,Backpack,N/A
"Hammonds Flycatcher Genuine Leather Laptop Bag for Men/Office Bag for Men, Brown | Fits Upto 16 Inch Laptop/MacBook| Leather Bag with Shoulder Straps | Laptop Messenger Bag/Leather Bag for Men |","2,591",https://amazon.in/HAMMONDS-FLYCATCHER-Genuine-Shoulder-Messenger/dp/B07P2TQH78,4.3 out of 5 stars,"4,893",B07P2TQH78,600 g,Hindustan Foam,LB106BLK,1.00 count,Leather Laptop Messenger Bag,N/A
Wesley Milestone 15.6 inch 25 L Casual Waterproof Laptop Backpack/Office Bag/School Bag/College Bag/Business Bag/Unisex Travel Backpack (Black),497,https://amazon.in/Wesley-Milestone-Waterproof-Backpack-Business/dp/B07NJRPJ6Q,4.3 out of 5 stars,"12,760",B07NJRPJ6Q,‎490 g,"‎Wesley, Longani Trading Company, F-82, Sector-1, Bawana Industrial Area, Delhi-110039",‎Wes-Mile-Black,1 U,Laptop backpack,"With a slim, sleek and compact   design you will love how this backpack can look small and compact even though   it has 2 spacious compartments to store your gadgets, books, keys and even a   water bottle!"
FATMUG Laptop Bag For Men - Convertible Backpack For Office And Travel (Light Grey Oxford Fabric),"1,499",https://amazon.in/FATMUG-Laptop-Bag-Men-Convertible/dp/B084LFX8ZZ,4.4 out of 5 stars,"1,911",B084LFX8ZZ,N/A,N/A,N/A,N/A,N/A,
Bennett™ Mystic 15.6 inch (39.6cm) Laptop Briefcase Shoulder Sling Office Business Professional Travel Messenger Bag for Men and Women Water Repellent Formal Executive Bags (Grey) 6 Months Warranty,499,https://amazon.in/BennettTM-Mystic-Shoulder-Messenger-Repellent/dp/B09321GJXZ,4.0 out of 5 stars,"5,741",B09321GJXZ,‎499 g,"‎Texcoco Enterprices, Texcoco Enterprices, 9958166528",‎Mystic,1 count,Laptop Briefcase,N/A
HEROZ Hammer Unisex Nylon 35 L Travel Laptop Backpack Water Resistant Slim Durable Fits Up to 17.3 Inch Laptop Notebook (Black),"1,199",https://amazon.in/HEROZ-Backpack-Resistant-Durable-Notebook/dp/B09B7KC93T,4.2 out of 5 stars,"1,129",B09B7KC93T,750 g,A. H. Creation,60,N/A,N/A,N/A
Tabelito® Laptop Bag For Men and women Briefcase 15.6 Inch (39.6 cm) Messenger Side Shoulder Travel bags for mens Water Resistant gifts office bag for men,549,https://amazon.in/Tabelito-Office-Laptop-Briefcase-Women/dp/B08FKXCJNQ,4.0 out of 5 stars,"2,560",B08FKXCJNQ,499 g,Tabelito,TAB-BC-G,1 U,Laptop Briefcase,N/A
"The Purple Tree Multifunction Waterproof Laptop Travel Backpack with Shoe Compartment, Shoulder Bag, 35 L Laptop Backpack with USB Charging, Flight Cabin Backpack, Antitheft Zipper Bag","2,499",https://amazon.in/Purple-Tree-Multifunction-Waterproof-Compartment/dp/B0BKSXQBXX,3.7 out of 5 stars,20,B0BKSXQBXX,640 g,N/A,BACKPACK00006_BLACK,1.00 count,BackPack,N/A
Half Moon 30L Waterproof 15.6 inch Laptop Office School College Bag Backpack for Men Women Boys & Girls,589,https://amazon.in/Half-Moon-Waterproof-Laptop-Backpack/dp/B09QM9N1B3,3.7 out of 5 stars,358,B09QM9N1B3,420 g,Half_Moon,Laptop backpack,N/A,school bags for boys,"FEATURES: DURABLE MATERIAL: Made with strong polyester fabric with heavy zippers. Serves the need of a professional office laptop bag, college bag, student backpack, school bag and is suitable for all, i.e. boys, girls, menं and womenं ; COMFY & STURDY: Its padded, adjustable shoulder straps do not put pressure on the shoulders. Foamed padded top handle is easy on your palm and fingers; DURABLE AND LIGHT WEIGHT MATERIAL: Made with strong yet light weight polyester fabric with heavy zippers; INTERNAL ORGANISER: This backpack features an Internal Organiser that is small pockets inside the front compartment for holding pens, ID cards, etc. These pockets are very useful in organizing your small day-to-day items; LOTS OF STORAGE SPACE & POCKETS: One separate Padded laptop compartment. Multiple compartments can store lots of stuff, that too organised."
ADISA Women Girls Floral Print Sling Bag,495,https://amazon.in/ADISA-Women-Girls-Floral-SL5072-CRE_Cream/dp/B09B56BCXR,4.3 out of 5 stars,511,B09B56BCXR,330 g,ADISA,SL5103-BLA,1.00 Handbag,Sling Bag,N/A
NIVIA Deflate Round 01 Polyester Gym Bag/Unisex Gym Bags/Adjustable Shoulder Bag for Men/Duffle Gym Bags for Men/Carry Gym Accessories/Fitness Bag/Sports &Travel Bag/Gym kit Bag,369,https://amazon.in/Nivia-Deflate-5180BK-Polyester-Round/dp/B07222KX3S,4.2 out of 5 stars,"7,546",B07222KX3S,N/A,N/A,N/A,N/A,N/A,
"SFANE Polyester 23 cms Navy Blue Gym Bag, Shoulder Bag, Sports Bag for Men & Women with Separate Shoes Compartment (Blue)",437,https://amazon.in/SFANE-Duffel-Shoulder-Women-Compartment/dp/B07ZC77WTW,4.4 out of 5 stars,"2,723",B07ZC77WTW,420 g,Sfane,BG - 05,1.00 count,N/A,N/A
Gear Workspace 18L Water Resistant Laptop Bag/Backpack/Office Bag for Men/Women-Black,879,https://amazon.in/Gear-Workspace-Briefcase-Black-Red-BKPWRPHYD0101/dp/B097KGL2M5,4.2 out of 5 stars,312,B097KGL2M5,560 g,Gear,BKPWRPHYD0101,1 count,Hybrid Briefcase Backpack,"Gear bags are designed for the quick commute as well for the long journey. These backpacks can be used as laptop bags, adventure bags and so on. Your favorite travel companion, the backpacks come with enough storage space to carry all your requirements."
Tabelito® Casual 15.6 Inch (39.6 cm) Water Repellent Laptop Backpack Office College School Business Travel Bag Suitable for Men Women Boys & Girls Capacity 25 Litre (Grey),549,https://amazon.in/Tabelito-Laptop-Backpack-15-6-inch-Repellent/dp/B08Y3L4PHK,4.1 out of 5 stars,"1,733",B08Y3L4PHK,‎449 g,"‎Tabelito Trade India, Tabelito Trade India, Prop No: 5, Ground Floor, Kh No:641, Village Rithala, Land Mark: Near Suzuki service center (Rithala), Contact : +919958166528",‎Laptop Backpack,1 Count,Casual Laptop Backpack,"1 x Roomy Main Compartment. Keep daily stuff like clothes, folder, books, magazines, power bank etc.1 x Front Side Pocket with zipper. Keep books, magazines, notebooks, wallet, Ipad etc.1 x Front Pocket with zipper. Keep Phone, pencil, keys, cards, and some other small items.1 x Laptop Compartment. Fit for laptop up to 15.6 inch.1 x Side Pocket. Keep for water bottle, cups, tumbler, umbrella etc.Handle: Sturdy handle and adjustable shoulder straps"
Lenovo 15.6-inch Casual Laptop Briefcase T210,799,https://amazon.in/Lenovo-Carrying-15-6-Inch-Toploader-GX40Q17229/dp/B075Y6Y9H5,4.2 out of 5 stars,"19,480",B075Y6Y9H5,340 g,"Lenovo, Ferns Icon, Level, 2, Outer Ring Rd, Doddanekundi, Mahadevapura, Bengaluru, Karnataka 560156",GX40Q17229,1 U,Backpack,N/A
NORTH ZONE Casual Waterproof Laptop Backpack/Office Bag/School Bag/College Bag/Business Bag/Travel Backpack (Dimensions:13x18 inches) (Compatible with 39.62cm(15.6inch laptop) 30 L,569,https://amazon.in/NORTH-ZONE-Waterproof-Backpack-Dimensions/dp/B0BS6QM2GD,4.0 out of 5 stars,314,B0BS6QM2GD,1 kg,SHABA BAGS,DB01,1.00 count,N/A,"Care Instructions: Do not expose to extreme heat The Hype 1 Casual Backpack from Northzone Sport features an elegant look and feel. It is a perfect every day carry for speedy city commutes, college or school. Keeping it unique and stylish, this Northzone backpack features a versatile shaded design with the Northzone logo print on the face of the bag. Sturdy, spacious and elegant are the spirit of this backpack. Plenty of Space & Pockets: This college bags for girls and boys features two spacious compartments that can each fit book, iPad, A4 size files, lunch box, light clothes, school supplies & accessories. It also features a zip compartment with multiple organizer pockets for keys, pens, pencils, cell phone, power bank, etc. The twin mesh pockets on each side helps pack in a water bottle and a compact umbrella. Lightweight & Sturdy: This school bags for girls and boys features a multi ventilated 10mm robust mesh padding that provides maximum back support. The straps are breathable, padded and adjustable that helps to relieve the stress on your shoulder. The top of the backpack features a webbing loop top handle that helps in carrying the backpack with ease. External Dimension: Length – 33cm, Width – 21cm, Height – 49cm, Weight – 1,000 grams. Capacity – 34 litres. Laptop Compatibility – yes"
"WILD MODA Women's Shoulder Bag, Set of 1",849,https://amazon.in/WILD-MODA-Womens-Shoulder-Turquoise/dp/B099PLT91X,4.2 out of 5 stars,"3,805",B099PLT91X,400 g,WILD MODA,WMWB0516,1.00 Unit,Shoulder Bag,N/A
"SHALIMAR large capacity Travel bag / Storage bag / Move-in bags/ Duffel Bag - Strong, Durable , Foldable and Water Resistant ( Pack of 1 ) ( Blue )",259,https://amazon.in/Shalimar-Capacity-Travel-Storage-Duffel/dp/B09TPHFMX7,4.0 out of 5 stars,396,B09TPHFMX7,306 g,"Vikrant Extrusion , Daman",SSTB1,1 count,Storage Bag,N/A
Half Moon 34 L Water Resistant 15.6 inch Laptop Bag/Backpack for Men Women Boys Girls/Office School College with Padded Laptop Compartment (Grey),599,https://amazon.in/Half-Moon-Waterproof-Backpack-Grey/dp/B09688CSCZ,3.9 out of 5 stars,"1,294",B09688CSCZ,390 g,Half_Moon (AB Amazing Bags),bag for menं,N/A,school bag,"Half Moon backpack is designed to be used everywhere you can use it as:- college bag(as it has numerous pockets inside), school bag(there is very large space inside the bag that can be used to carry numerous books), travel backpack(the volume of this backpack is 35 litres and that is enough for travelling), laptop bag(as it contains a laptop sleeve). It is navy in colour so that it will not become dirty easily it has padded straps to make it easy to carry. It is fully waterproof to protect your laptop, books etc from water and rain. The material used in this bag is dust-free so, that it can produce your backpack from dust. It has a rain cover which is very useful in the rainy season to protect your backpack from rain. It can be used everywhere as well as by everyone be it menं , womenं , boys and girls."
"Storite Pack of 2 Heavy Duty Canvas Grocery Shopping Bags with Reinforced Handles (40x20x33-cm, Green)",528,https://amazon.in/Storite-Grocery-Shopping-Reinforced-40x20x33-cm/dp/B079T66RBW,4.3 out of 5 stars,"2,140",B079T66RBW,N/A,N/A,N/A,N/A,N/A,
DZert Kids School Bag Soft Plush Backpacks Cartoon Boys Girls Baby (2-5 Years),225,https://amazon.in/DZert-Kids-Grey-School-Years/dp/B07QD1M3R9,3.7 out of 5 stars,"3,097",B07QD1M3R9,300 g,Rushi Enterprise,SF-BAG-P-HATHI-1,1.00 count,Kids Bag,DZert Provide Premium quality bags which are non-toxic and made up of soft velvet because our priority is to provide best and high-quality bags/ backpack to your kids.
POLICE Polyester 35 Ltr Laptop Big Low Spec Laptop Backpack - Black/Navy,"1,569",https://amazon.in/Police-Polyester-Laptop-Spec-Backpack/dp/B07ZB8NWTZ,3.3 out of 5 stars,202,B07ZB8NWTZ,560 g,Torero Corporation Pvt Ltd,PTO022671_5-5,1 Count,Backpack,N/A
F Gear String 11 Ltrs Nylon Black Gym Bag,189,https://amazon.in/F-Gear-String-Polyester-33-cms-Black-Drawstring-Gym-Bag/dp/B07PC28YQ9,4.0 out of 5 stars,505,B07PC28YQ9,100 g,Uber Fashion Merchandise Pvt. Ltd.,Uber007,1 count,Drawstring Gym Bag,The product will be an excellent pick for you. It ensures an easy maintenance.
Bennett™ Mystic Unisex Adult Men's Laptop Bag 15.6 inch Side Shoulder Briefcase Satchel Messenger Business Bags for Men & Women Front Pocket for Laptop Accessories - Black (6 Month Warranty),512,https://amazon.in/BennettTM-Shoulder-Messenger-Repellent-Charcoal/dp/B09CV24TMK,4.0 out of 5 stars,"5,741",B09CV24TMK,‎449 g,"‎Texcoco Enterprices, 9958166528, ?Texcoco Enterprices, 9958166528",‎BEN-BC-BLACK,1 count,Laptop Bag,N/A
ASTRID Blue Diamond Textured Cotton Tote Bag,599,https://amazon.in/ASTRID-Blue-Diamond-Textured-Cotton/dp/B08W5DQ33D,4.3 out of 5 stars,130,B08W5DQ33D,540 g,SAAV TEX PVT LTD,ASTD0163,1.00 count,N/A,N/A
"Bennett Casual Laptop Bag school bags for boys girls 15.6-inch, 25 LTR Office & College bags for mens Water Repellent Backpack for Men & Women (GREY)",512,https://amazon.in/Bennett-15-6-inch-College-Repellent-Backpack/dp/B09WZKHSDR,3.9 out of 5 stars,573,B09WZKHSDR,‎459 g,"‎Texcoco Enterprises, 9958166528, Texcoco Enterprises, 9958166528",‎ben_cas_grey,1 Count,Laptop Backpack,N/A
"WILD MODA Women's Shoulder Bag, Set of 1",849,https://amazon.in/WILD-MODA-Womens-Shoulder-Turquoise/dp/B099PLT91X,4.2 out of 5 stars,"3,805",B099PLT91X,N/A,N/A,N/A,N/A,N/A,
ASTRID Women's Round Sling Bag with Pompoms (Brown),499,https://amazon.in/ASTRID-Womens-Round-Sling-Pompoms/dp/B08VS8JBNK,4.4 out of 5 stars,429,B08VS8JBNK,340 g,SAAV TEX PVT LTD,ASTD0280,1.00 count,N/A,N/A
"Luv Lap LuvLap Baby Breast Milk Storage Bags (Pack of 25), BPA Free Disposable Milk Freezer Bags for Breast Feeding, Transparent",319,https://amazon.in/Storage-Disposable-Freezer-Feeding-Transparent/dp/B099ZZ57FT,4.4 out of 5 stars,640,B099ZZ57FT,N/A,N/A,N/A,N/A,N/A,"Baby Breast Milk Storage Bags, BPA Free Disposable Milk Freezer Bags for Breast Feeding (Pack of 25 Bags)"
"Nivia 5227 Pulse Junior Bag, Others (Orange) (Sky Blue)",294,https://amazon.in/Nivia-5227-Pulse-Junior-Others/dp/B08D7QG33Z,3.7 out of 5 stars,180,B08D7QG33Z,N/A,N/A,N/A,N/A,N/A,
Gear Turbo 45L Expandable Water Resistant Antitheft Laptop Bag/Backpack/Briefcase for Men/Women with RainCover (Grey),"1,795",https://amazon.in/Gear-Expandable-RainCover-Grey-Black-TLPTURBO00401/dp/B097KDRZ67,4.4 out of 5 stars,932,B097KDRZ67,1 kg,N/A,TLPTURBO00401,N/A,N/A,N/A
Gear Turbo 45L Expandable Water Resistant Antitheft Laptop Bag/Backpack/Briefcase for Men/Women with RainCover (Grey),"1,795",https://amazon.in/Gear-Expandable-RainCover-Grey-Black-TLPTURBO00401/dp/B097KDRZ67,4.4 out of 5 stars,932,B097KDRZ67,1 kg,N/A,TLPTURBO00401,N/A,N/A,N/A
Martucci 15.6 inch 30 L Casual Waterproof Laptop Backpack/Office Bag/School Bag/College Bag/Business Bag/Unisex Travel Backpack(Black),549,https://amazon.in/Martucci-Casual-Travelling-Laptop-Backpack/dp/B088B4P6ZW,3.9 out of 5 stars,"7,494",B088B4P6ZW,350 g,Martucci,N/A,1.00 count,N/A,N/A
"PAZZO Alto 40L Casual Backpack - 3 Compartment Travel Backpack, College|School Bag with 1 Year Warranty",849,https://amazon.in/PAZZO-Alto-40L-Casual-Backpack/dp/B07VT3F795,4.0 out of 5 stars,"1,737",B07VT3F795,400 g,PAZZO,Alto,N/A,N/A,N/A
ADISA 15.6 inch Laptop Backpack Office Bag College Travel Back Pack 32 Ltrs (z-Teal),499,https://amazon.in/ADISA-Laptop-Backpack-Office-College/dp/B09TPVD964,3.9 out of 5 stars,801,B09TPVD964,530 g,ADISA,BP041,1.00 count,Laptop backpack,N/A
Wildcraft Turnaround Polyester 14 inch 27 Ltrs Blue Laptop Bag (8903340000000),"1,797",https://amazon.in/Wildcraft-Turnaround-Polyester-Laptop-8903340000000/dp/B012D4QWES,4.3 out of 5 stars,"3,289",B012D4QWES,520 g,Wildcraft,8.90E+12,N/A,N/A,The durable Peza workpack is designed for travel enthusiasts. It perfectly organizes your belongings and comes with a specially designed padded back system for enhanced carrying comfort. Laptop Compatible: Fits up to 15.4 laptop ; Quick-access side mesh pocket ; Ventex back system allows ventilation and better airflow.
"Half Moon Curiosity 35L Water Resistant 15.6"" Laptop Bag for Men/Backpack for Men, Black | Office Bag for Men/Office Bag for Women with Padded Laptop Compartment | Rain Cover & Slim Durable Backpack",749,https://amazon.in/Half-Moon-Curiosity-Backpack-Resistant/dp/B09S3ZK3N1,3.8 out of 5 stars,177,B09S3ZK3N1,670 g,Half_Moon(Amazing Bags),Curiosity,N/A,laptop bag for menं,N/A
"Palay Waist Bag For Unisex With Adjustable Strap, Waterproof Fanny Pack Stylish Chest Bag Bum Bag With 4-Zipper Pockets For Travel Party Festival Running Hiking",584,https://amazon.in/PALAY%C2%AE-Shoulder-4-Zipper-Pockets-Adjustable/dp/B08SWGFBNT,4.4 out of 5 stars,308,B08SWGFBNT,139 g,N/A,N/A,1.00 count,N/A,N/A
"WILD MODA Women's Shoulder Bag, Set of 1",849,https://amazon.in/WILD-MODA-Womens-Shoulder-Turquoise/dp/B099PLT91X,4.2 out of 5 stars,"3,805",B099PLT91X,400 g,WILD MODA,WMWB0516,1.00 Unit,Shoulder Bag,N/A
Asus BP1504 39.62 cm (15.6-inch) Laptop Backpack (Dark Grey),N/A,https://amazon.in/Asus-BP1504-15-6-inch-Laptop-Backpack/dp/B0895ZZHKK,4.2 out of 5 stars,"1,624",B0895ZZHKK,‎385 g,"‎ASUS, Shanghai Korrun Bag & Luggage Production Co. , Lt d",‎BP1504,1 Count,Laptop Backpack,N/A
